<?xml version="1.0" encoding="ISO-8859-1" ?>
<!DOCTYPE fichier_personnel SYSTEM "fichier_personnel.dtd">
<fichier_personnel>
<personne nom="Prosper Têtedeuf">
  <bio>
    <yeux couleur="bleugris" />
    <cheveux couleur="blonds" remarque="parfois teints" />
    <peau couleur="blanche" />
    <poids kg="74" />
    <groupe_sanguin type="A" />
  </bio>
  <socio>
    <langue lang="française" abr="fr" />
    <etat_civil type="marie" />
    <passeport no="38385409398" />
  </socio>
</personne>
</fichier_personnel>


